{
  "catalogo_id": "a-cosa-ho-diritto-2026",
  "versione": "0.2.0",
  "generato_il": "2026-09-24T15:10:00+02:00",
  "anno_imposta_riferimento": 2026,
  "fonti": [
    {
      "fonte_id": "ade-ristrutturazioni-cittadini",
      "ente": "agenzia_entrate",
      "url_fonte": "https://www.agenziaentrate.gov.it/portale/schede/agevolazioni/detrristredil36/schinfodetrristredil36-cittadini",
      "data_consultazione": "2026-09-24"
    },
    {
      "fonte_id": "ade-ristrutturazioni-misura-detrazione",
      "ente": "agenzia_entrate",
      "url_fonte": "https://www.agenziaentrate.gov.it/portale/la-misura-della-detrazione-limiti-detraibilita",
      "data_consultazione": "2026-09-24"
    },
    {
      "fonte_id": "ade-bonus-mobili-cittadini",
      "ente": "agenzia_entrate",
      "url_fonte": "https://www.agenziaentrate.gov.it/portale/bonus-mobili/infogen-bonus-mobili-cittadini",
      "data_consultazione": "2026-09-24"
    },
    {
      "fonte_id": "ade-spese-sanitarie-aspetti-generali",
      "ente": "agenzia_entrate",
      "url_fonte": "https://www.agenziaentrate.gov.it/portale/aspetti-generali",
      "data_consultazione": "2026-09-24"
    },
    {
      "fonte_id": "inps-circolare-7-2026-auu",
      "ente": "inps",
      "url_fonte": "https://www.inps.it/content/dam/inps-site/it/scorporati/circolari-e-messaggi/2026/01/Circolare_15152/Allegati/16548_Circolare-numero-7-del-30-01-2026.pdf",
      "data_consultazione": "2026-09-24"
    },
    {
      "fonte_id": "inps-circolare-7-2026-auu-allegato-1",
      "ente": "inps",
      "url_fonte": "https://www.inps.it/content/dam/inps-site/it/scorporati/circolari-e-messaggi/2026/01/Circolare_15152/Allegati/16549_Circolare-numero-7-del-30-01-2026_Allegato-n-1.pdf",
      "data_consultazione": "2026-09-24"
    },
    {
      "fonte_id": "inps-cs-bonus-asilo-nido-2026",
      "ente": "inps",
      "url_fonte": "https://www.inps.it/content/dam/inps-site/it/scorporati/comunicati-stampa/2026/03/Allegati/4065_CS-BONUS-ASILI-NIDO.pdf",
      "data_consultazione": "2026-09-24"
    },
    {
      "fonte_id": "ade-detrazioni-canoni-locazione-tabella",
      "ente": "agenzia_entrate",
      "url_fonte": "https://www.agenziaentrate.gov.it/portale/documents/20143/5629825/Detrazioni+per+canoni+di+locazione_tabella_aggiornata.pdf/f76fe2b8-ecab-9d12-1986-752885a8b95a",
      "data_consultazione": "2026-09-24"
    }
  ],
  "voci": [
    {
      "misura": {
        "misura_id": "bonus-ristrutturazioni",
        "nome": "Ristrutturazioni edilizie",
        "tipo": "detrazione",
        "descrizione_fonte": "Una detrazione dall'IRPEF, da ripartire in 10 quote annuali di pari importo, del 36% delle spese sostenute. Per le spese sostenute negli anni 2025 e 2026, la detrazione spetta nella misura del 36% (ovvero del 50% in caso di abitazione principale), su un massimo di 96.000 euro per unità immobiliare. Disciplinata dall'articolo 16-bis del Dpr 917/86 (Testo unico delle imposte sui redditi - TUIR).",
        "anno_riferimento": 2026,
        "beneficio": {
          "forma": "percentuale",
          "percentuale": 36,
          "tetto_massimo_euro": 96000,
          "base_tetto": "per unità immobiliare",
          "testo_fonte": "\"Per le spese sostenute negli anni 2025 e 2026, la detrazione spetta nella misura del 36% (ovvero del 50% in caso di abitazione principale)\"; \"Su un massimo di 96.000 euro per unità immobiliare\"",
          "source_refs": [
            "ade-ristrutturazioni-cittadini#aliquote-2025-2026",
            "ade-ristrutturazioni-cittadini#limite-di-spesa",
            "ade-ristrutturazioni-misura-detrazione#aliquote-2025-2026"
          ]
        },
        "requisiti": [
          {
            "requisito_id": "spesa-sostenuta-2025-2026",
            "tipo_requisito": "temporale",
            "descrizione_fonte": "Per le spese sostenute negli anni 2025 e 2026, la detrazione spetta nella misura del 36% (ovvero del 50% in caso di abitazione principale)",
            "obbligatorio": true,
            "source_refs": [
              "ade-ristrutturazioni-cittadini#aliquote-2025-2026"
            ]
          },
          {
            "requisito_id": "abitazione-principale",
            "tipo_requisito": "immobile",
            "descrizione_fonte": "occorre, inoltre, che l'unità immobiliare sulla quale sono stati effettuati gli interventi sia adibita ad abitazione principale. Per \"abitazione principale\" deve intendersi quella nella quale la persona fisica dimorano abitualmente",
            "obbligatorio": false,
            "source_refs": [
              "ade-ristrutturazioni-misura-detrazione#requisiti-aliquota-maggiorata"
            ]
          },
          {
            "requisito_id": "titolarita-diritto-reale",
            "tipo_requisito": "immobile",
            "descrizione_fonte": "è necessario che il contribuente sia titolare, al momento di inizio dei lavori di un diritto di PROPRIETÀ o di un diritto reale di godimento sull'unità immobiliare",
            "obbligatorio": false,
            "source_refs": [
              "ade-ristrutturazioni-misura-detrazione#requisiti-aliquota-maggiorata"
            ]
          }
        ],
        "scadenza": {
          "tipo_scadenza": "fine_anno_imposta",
          "conseguenza_mancato_rispetto": "per le spese del 2027 \"detrazione del 36% (con limite massimo di spesa agevolabile di 96.000 euro)\" per abitazione principale; dal 2028 al 2033 \"detrazione del 30%, con limite massimo di spesa agevolabile di 48.000 euro, per tutte le abitazioni\"",
          "source_refs": [
            "ade-ristrutturazioni-misura-detrazione#aliquote-2027-2033"
          ]
        },
        "recupero": {
          "rate_annuali": 10,
          "anni_pregressi_recuperabili": 0,
          "descrizione_fonte": "\"Una detrazione dall'IRPEF, da ripartire in 10 quote annuali di pari importo\". La fonte letta non dichiara per quanti anni pregressi la misura sia recuperabile: il valore 0 è imposto dal contratto, che non ammette l'assenza del campo, e il dato è dichiarato in dati_mancanti.",
          "source_refs": [
            "ade-ristrutturazioni-cittadini#in-cosa-consiste",
            "ade-ristrutturazioni-cittadini#quote-annuali"
          ]
        },
        "documenti_richiesti": [],
        "canali_accesso": [
          "dichiarazione_redditi"
        ],
        "situazioni_vita_collegate": [
          "casa"
        ],
        "timing_compatibile": [
          "da_iniziare",
          "in_corso"
        ],
        "dati_mancanti": [
          "recupero",
          "documenti"
        ],
        "source_refs": [
          "ade-ristrutturazioni-cittadini#in-cosa-consiste",
          "ade-ristrutturazioni-cittadini#riferimento-normativo",
          "ade-ristrutturazioni-misura-detrazione#riferimento-normativo"
        ]
      },
      "spiegazione": {
        "misura_id": "bonus-ristrutturazioni",
        "titolo_semplice": "Sconto sulle tasse se ristrutturi casa",
        "cosa_e": "La detrazione per le ristrutturazioni edilizie è uno sconto sull'IRPEF. L'IRPEF è l'imposta che paghi sul tuo reddito. Lo sconto vale sulle spese che sostieni per ristrutturare. Non ricevi soldi: paghi meno tasse. Lo recuperi in 10 quote annuali di pari importo, cioè una quota all'anno per dieci anni. La regola è l'articolo 16-bis del Dpr 917/86, il Testo unico delle imposte sui redditi (TUIR).",
        "quanto_vale": "Per le spese sostenute negli anni 2025 e 2026 la detrazione è del 36%. La detrazione sale al 50% in caso di abitazione principale. Il limite massimo di spesa è 96.000 euro per unità immobiliare. Lo sconto si divide in 10 quote annuali di pari importo.",
        "a_chi_spetta": [
          "Se sostieni la spesa negli anni 2025 e 2026, la detrazione è del 36%. Diventa del 50% in caso di abitazione principale.",
          "Se l'unità immobiliare su cui fai i lavori è adibita ad abitazione principale, la detrazione è del 50%. Abitazione principale è quella nella quale la persona fisica dimora abitualmente.",
          "Per la detrazione del 50% devi essere titolare di un diritto di proprietà. In alternativa devi essere titolare di un diritto reale di godimento sull'unità immobiliare. Devi esserlo al momento di inizio dei lavori."
        ],
        "attenzione": [
          "Devi essere titolare della proprietà o di un altro diritto reale di godimento sull'unità immobiliare già al momento di inizio dei lavori: è la condizione che la fonte chiede per la detrazione del 50%.",
          "La detrazione del 50% vale per l'unità immobiliare adibita ad abitazione principale, cioè quella in cui dimori abitualmente. Negli altri casi in cui l'agevolazione spetta, la detrazione è del 36%.",
          "Il limite massimo di spesa agevolabile di 96.000 euro si conta per unità immobiliare.",
          "Per le spese del 2027 la detrazione per l'abitazione principale è del 36%. Il limite massimo di spesa agevolabile resta di 96.000 euro.",
          "Dal 2028 al 2033 la detrazione è del 30%, per tutte le abitazioni. Il limite massimo di spesa agevolabile è di 48.000 euro.",
          "La fonte letta non elenca i documenti da presentare o da conservare e non indica con quale mezzo vanno pagate le spese: chiedi a un CAF quali documenti tenere e come pagare, prima di cominciare i lavori.",
          "La fonte letta non dice per quanti anni indietro puoi ancora recuperare questa detrazione."
        ],
        "glossario": [
          {
            "termine": "detrazione",
            "spiegazione_semplice": "detrazione: uno sconto sulle tasse che devi pagare."
          },
          {
            "termine": "IRPEF",
            "spiegazione_semplice": "IRPEF: l'imposta che paghi allo Stato sul tuo reddito."
          },
          {
            "termine": "unità immobiliare",
            "spiegazione_semplice": "unità immobiliare: una singola casa o un singolo locale accatastato a sé."
          },
          {
            "termine": "abitazione principale",